{
  "availability_id": "RKE-REPORT-INDUSTRY-ETF-PROXY-PIT-AVAILABILITY",
  "labelability_summary": {
    "benchmark_series_missing_count": 0,
    "data_gap_counts": {
      "direction_missing_or_unsupported": 12
    },
    "eligible_claim_count": 0,
    "labelable_claim_count": 0,
    "labelable_window_count": 0,
    "pending_future_window_count": 0,
    "proxy_series_missing_count": 0,
    "sector_etf_mapping_missing_count": 0
  },
  "mapping_count": 17,
  "mapping_records": [
    {
      "available_window_days": [
        20,
        60,
        120
      ],
      "benchmark_available": true,
      "benchmark_family": "CSI300_ETF_PROXY",
      "benchmark_source": "cn_etf",
      "benchmark_symbol": "SH510300",
      "calendar_source": "~/.qlib/qlib_data/cn_etf",
      "earliest_price_date": "2021-02-04",
      "effective_from": "",
      "effective_to": "",
      "etf_symbol": "SH516160",
      "has_120d_window": true,
      "has_20d_window": true,
      "has_60d_window": true,
      "latest_calendar_date": "2026-06-05",
      "latest_price_date": "2026-06-05",
      "mapping_id": "IETF-MAP-a4ca3639be3d5890",
      "mapping_version": 1,
      "missing_price_count": 0,
      "pit_available": true,
      "pit_gap_reasons": [],
      "sector_name": "光伏设备",
      "stale_price_gap_count": 0,
      "status": "primary"
    },
    {
      "available_window_days": [
        20,
        60,
        120
      ],
      "benchmark_available": true,
      "benchmark_family": "CSI300_ETF_PROXY",
      "benchmark_source": "cn_etf",
      "benchmark_symbol": "SH510300",
      "calendar_source": "~/.qlib/qlib_data/cn_etf",
      "earliest_price_date": "2019-06-17",
      "effective_from": "",
      "effective_to": "",
      "etf_symbol": "SH512170",
      "has_120d_window": true,
      "has_20d_window": true,
      "has_60d_window": true,
      "latest_calendar_date": "2026-06-05",
      "latest_price_date": "2026-06-05",
      "mapping_id": "IETF-MAP-b365b9eebf6c83a8",
      "mapping_version": 1,
      "missing_price_count": 1,
      "pit_available": true,
      "pit_gap_reasons": [],
      "sector_name": "化学制药",
      "stale_price_gap_count": 1,
      "status": "primary"
    },
    {
      "available_window_days": [
        20,
        60,
        120
      ],
      "benchmark_available": true,
      "benchmark_family": "CSI300_ETF_PROXY",
      "benchmark_source": "cn_etf",
      "benchmark_symbol": "SH510300",
      "calendar_source": "~/.qlib/qlib_data/cn_etf",
      "earliest_price_date": "2019-06-17",
      "effective_from": "",
      "effective_to": "",
      "etf_symbol": "SH512170",
      "has_120d_window": true,
      "has_20d_window": true,
      "has_60d_window": true,
      "latest_calendar_date": "2026-06-05",
      "latest_price_date": "2026-06-05",
      "mapping_id": "IETF-MAP-04bd06f08e748006",
      "mapping_version": 1,
      "missing_price_count": 1,
      "pit_available": true,
      "pit_gap_reasons": [],
      "sector_name": "医药商业",
      "stale_price_gap_count": 1,
      "status": "primary"
    },
    {
      "available_window_days": [
        20,
        60,
        120
      ],
      "benchmark_available": true,
      "benchmark_family": "CSI300_ETF_PROXY",
      "benchmark_source": "cn_etf",
      "benchmark_symbol": "SH510300",
      "calendar_source": "~/.qlib/qlib_data/cn_etf",
      "earliest_price_date": "2019-06-12",
      "effective_from": "",
      "effective_to": "",
      "etf_symbol": "SH512480",
      "has_120d_window": true,
      "has_20d_window": true,
      "has_60d_window": true,
      "latest_calendar_date": "2026-06-05",
      "latest_price_date": "2026-06-05",
      "mapping_id": "IETF-MAP-94c5b2955fe21c0a",
      "mapping_version": 1,
      "missing_price_count": 1,
      "pit_available": true,
      "pit_gap_reasons": [],
      "sector_name": "半导体",
      "stale_price_gap_count": 1,
      "status": "primary"
    },
    {
      "available_window_days": [
        20,
        60,
        120
      ],
      "benchmark_available": true,
      "benchmark_family": "CSI300_ETF_PROXY",
      "benchmark_source": "cn_etf",
      "benchmark_symbol": "SH510300",
      "calendar_source": "~/.qlib/qlib_data/cn_etf",
      "earliest_price_date": "2016-08-08",
      "effective_from": "",
      "effective_to": "",
      "etf_symbol": "SH512880",
      "has_120d_window": true,
      "has_20d_window": true,
      "has_60d_window": true,
      "latest_calendar_date": "2026-06-05",
      "latest_price_date": "2026-06-05",
      "mapping_id": "IETF-MAP-8b60666835d4ff91",
      "mapping_version": 1,
      "missing_price_count": 0,
      "pit_available": true,
      "pit_gap_reasons": [],
      "sector_name": "多元金融",
      "stale_price_gap_count": 0,
      "status": "primary"
    },
    {
      "available_window_days": [
        20,
        60,
        120
      ],
      "benchmark_available": true,
      "benchmark_family": "CSI300_ETF_PROXY",
      "benchmark_source": "cn_etf",
      "benchmark_symbol": "SH510300",
      "calendar_source": "~/.qlib/qlib_data/cn_etf",
      "earliest_price_date": "2017-09-01",
      "effective_from": "",
      "effective_to": "",
      "etf_symbol": "SH512400",
      "has_120d_window": true,
      "has_20d_window": true,
      "has_60d_window": true,
      "latest_calendar_date": "2026-06-05",
      "latest_price_date": "2026-06-05",
      "mapping_id": "IETF-MAP-23de168b3e721a82",
      "mapping_version": 1,
      "missing_price_count": 0,
      "pit_available": true,
      "pit_gap_reasons": [],
      "sector_name": "工业金属",
      "stale_price_gap_count": 0,
      "status": "primary"
    },
    {
      "available_window_days": [
        20,
        60,
        120
      ],
      "benchmark_available": true,
      "benchmark_family": "CSI300_ETF_PROXY",
      "benchmark_source": "cn_etf",
      "benchmark_symbol": "SH510300",
      "calendar_source": "~/.qlib/qlib_data/cn_etf",
      "earliest_price_date": "2017-09-25",
      "effective_from": "",
      "effective_to": "",
      "etf_symbol": "SH512200",
      "has_120d_window": true,
      "has_20d_window": true,
      "has_60d_window": true,
      "latest_calendar_date": "2026-06-05",
      "latest_price_date": "2026-06-05",
      "mapping_id": "IETF-MAP-753cd02e2bb4e5a4",
      "mapping_version": 1,
      "missing_price_count": 0,
      "pit_available": true,
      "pit_gap_reasons": [],
      "sector_name": "房地产开发",
      "stale_price_gap_count": 0,
      "status": "primary"
    },
    {
      "available_window_days": [
        20,
        60,
        120
      ],
      "benchmark_available": true,
      "benchmark_family": "CSI300_ETF_PROXY",
      "benchmark_source": "cn_etf",
      "benchmark_symbol": "SH510300",
      "calendar_source": "~/.qlib/qlib_data/cn_etf",
      "earliest_price_date": "2017-09-01",
      "effective_from": "",
      "effective_to": "",
      "etf_symbol": "SH512400",
      "has_120d_window": true,
      "has_20d_window": true,
      "has_60d_window": true,
      "latest_calendar_date": "2026-06-05",
      "latest_price_date": "2026-06-05",
      "mapping_id": "IETF-MAP-c894bff241476c90",
      "mapping_version": 1,
      "missing_price_count": 0,
      "pit_available": true,
      "pit_gap_reasons": [],
      "sector_name": "有色金属",
      "stale_price_gap_count": 0,
      "status": "primary"
    },
    {
      "available_window_days": [
        20,
        60,
        120
      ],
      "benchmark_available": true,
      "benchmark_family": "CSI300_ETF_PROXY",
      "benchmark_source": "cn_etf",
      "benchmark_symbol": "SH510300",
      "calendar_source": "~/.qlib/qlib_data/cn_etf",
      "earliest_price_date": "2020-02-10",
      "effective_from": "",
      "effective_to": "",
      "etf_symbol": "SH515700",
      "has_120d_window": true,
      "has_20d_window": true,
      "has_60d_window": true,
      "latest_calendar_date": "2026-06-05",
      "latest_price_date": "2026-06-05",
      "mapping_id": "IETF-MAP-704cd26db24b78a3",
      "mapping_version": 1,
      "missing_price_count": 0,
      "pit_available": true,
      "pit_gap_reasons": [],
      "sector_name": "汽车零部件",
      "stale_price_gap_count": 0,
      "status": "primary"
    },
    {
      "available_window_days": [
        20,
        60,
        120
      ],
      "benchmark_available": true,
      "benchmark_family": "CSI300_ETF_PROXY",
      "benchmark_source": "cn_etf",
      "benchmark_symbol": "SH510300",
      "calendar_source": "~/.qlib/qlib_data/cn_etf",
      "earliest_price_date": "2020-02-10",
      "effective_from": "",
      "effective_to": "",
      "etf_symbol": "SH515700",
      "has_120d_window": true,
      "has_20d_window": true,
      "has_60d_window": true,
      "latest_calendar_date": "2026-06-05",
      "latest_price_date": "2026-06-05",
      "mapping_id": "IETF-MAP-f3e42a6cf3f7fe37",
      "mapping_version": 1,
      "missing_price_count": 0,
      "pit_available": true,
      "pit_gap_reasons": [],
      "sector_name": "电池",
      "stale_price_gap_count": 0,
      "status": "primary"
    },
    {
      "available_window_days": [
        20,
        60,
        120
      ],
      "benchmark_available": true,
      "benchmark_family": "CSI300_ETF_PROXY",
      "benchmark_source": "cn_etf",
      "benchmark_symbol": "SH510300",
      "calendar_source": "~/.qlib/qlib_data/cn_etf",
      "earliest_price_date": "2016-08-08",
      "effective_from": "",
      "effective_to": "",
      "etf_symbol": "SH512660",
      "has_120d_window": true,
      "has_20d_window": true,
      "has_60d_window": true,
      "latest_calendar_date": "2026-06-05",
      "latest_price_date": "2026-06-05",
      "mapping_id": "IETF-MAP-4c92946dcaa3af50",
      "mapping_version": 1,
      "missing_price_count": 0,
      "pit_available": true,
      "pit_gap_reasons": [],
      "sector_name": "航天装备Ⅱ",
      "stale_price_gap_count": 0,
      "status": "primary"
    },
    {
      "available_window_days": [
        20,